{
  "$schema": "../../system/schemas/metaObjectStorableSettings.schema.json",
  "uid": "b03c6bce-e7c3-40df-86a3-c5897a1c6e12",
  "metaObjectKindUid": "5449a8ad-9359-41b2-8ff2-3f415eb4da76",
  "title": "Статус релиза",
  "name": "release_status",
  "memo": "Определяет этап жизненного цикла релиза.",
  "editMethod": 0,
  "orderByExpression": "",
  "displayExpression": "",
  "listFormUid": null,
  "itemFormUid": null,
  "showMainImage": false,
  "saveHistory": 0,
  "version": 0,
  "isActive": true,
  "header": {
    "uid": "d48243bb-b5da-4d55-bf7e-c0e02cde0e91",
    "title": "header",
    "name": "header",
    "memo": "",
    "autoClearMethod": 0,
    "columns": [
      {
        "uid": "31678347-30b4-428e-b6f4-42dceed59abe",
        "kind": 0,
        "standardColumnUid": "3cceebad-7d5a-4943-a102-6267e22227a8",
        "title": "Name",
        "name": "name",
        "formula": "",
        "itemsSource": "",
        "autoClearMethod": 0,
        "isStandard": true,
        "dataSettings": {
          "dataTypeUid": "0234c067-7868-46b2-ba8e-e22fae5255cb",
          "stringLength": 20,
          "numberDigits": 2,
          "primaryKey": true,
          "required": false,
          "unique": false,
          "defaultValue": null
        },
        "renderSettings": {
          "controlKindUid": "",
          "showInItem": true,
          "showInList": true,
          "listColumnWidth": ""
        },
        "validationSettings": {
          "notEmpty": false
        },
        "dependencies": []
      },
      {
        "uid": "15ba6255-f04a-4d76-aa91-36649b6c5063",
        "kind": 0,
        "standardColumnUid": "1e0063d0-288d-494a-8761-1185300d571d",
        "title": "Is deleted",
        "name": "is_deleted",
        "formula": "",
        "itemsSource": "",
        "autoClearMethod": 0,
        "isStandard": true,
        "dataSettings": {
          "dataTypeUid": "4bff64cf-eb01-4933-9f3d-b902336751f4",
          "stringLength": 0,
          "numberDigits": 2,
          "primaryKey": false,
          "required": false,
          "unique": false,
          "defaultValue": null
        },
        "renderSettings": {
          "controlKindUid": "",
          "showInItem": false,
          "showInList": false,
          "listColumnWidth": ""
        },
        "validationSettings": {
          "notEmpty": false
        },
        "dependencies": []
      },
      {
        "uid": "0aeb4c9d-e5e4-4404-89cf-7bf5caba12d1",
        "kind": 0,
        "standardColumnUid": "e647fb57-470e-4547-9a94-2be0f3d0985e",
        "title": "Code",
        "name": "code",
        "formula": "",
        "itemsSource": "",
        "autoClearMethod": 0,
        "isStandard": true,
        "dataSettings": {
          "dataTypeUid": "0234c067-7868-46b2-ba8e-e22fae5255cb",
          "stringLength": 3,
          "numberDigits": 2,
          "primaryKey": false,
          "required": true,
          "unique": true,
          "defaultValue": null
        },
        "renderSettings": {
          "controlKindUid": "",
          "showInItem": true,
          "showInList": true,
          "listColumnWidth": ""
        },
        "validationSettings": {
          "notEmpty": true
        },
        "dependencies": []
      },
      {
        "uid": "5f73a648-4377-4107-a983-96f0ebf1e8e0",
        "kind": 0,
        "standardColumnUid": "91a26ae4-5723-4109-8322-7e4e59129239",
        "title": "Title",
        "name": "title",
        "formula": "",
        "itemsSource": "",
        "autoClearMethod": 0,
        "isStandard": true,
        "dataSettings": {
          "dataTypeUid": "0234c067-7868-46b2-ba8e-e22fae5255cb",
          "stringLength": 100,
          "numberDigits": 2,
          "primaryKey": false,
          "required": true,
          "unique": false,
          "defaultValue": null
        },
        "renderSettings": {
          "controlKindUid": "",
          "showInItem": true,
          "showInList": true,
          "listColumnWidth": ""
        },
        "validationSettings": {
          "notEmpty": true
        },
        "dependencies": []
      }
    ],
    "indexes": [
      {
        "uid": "758d47ed-8721-4aaf-9927-5fce4d14a999",
        "columns": [
          {
            "columnUid": "15ba6255-f04a-4d76-aa91-36649b6c5063",
            "direction": 0
          }
        ]
      },
      {
        "uid": "49271d2f-2f57-4773-8409-e7d22cc0a378",
        "columns": [
          {
            "columnUid": "0aeb4c9d-e5e4-4404-89cf-7bf5caba12d1",
            "direction": 0
          }
        ]
      }
    ]
  },
  "detailTables": [],
  "commands": [],
  "recordsSources": [],
  "recordsSettings": []
}