{
  "$schema": "../../system/schemas/metaObjectStorableSettings.schema.json",
  "uid": "6c250d8f-c65b-43bb-84b4-7e0c8271f79d",
  "metaObjectKindUid": "5449a8ad-9359-41b2-8ff2-3f415eb4da76",
  "title": "Срочность",
  "name": "urgency",
  "memo": "Определяет требуемую скорость реакции на обращение.",
  "editMethod": 0,
  "orderByExpression": "",
  "displayExpression": "",
  "listFormUid": null,
  "itemFormUid": null,
  "showMainImage": false,
  "saveHistory": 0,
  "version": 0,
  "isActive": true,
  "header": {
    "uid": "086339f0-48ac-4db7-9ae2-4f762bd16bd8",
    "title": "header",
    "name": "header",
    "memo": "",
    "autoClearMethod": 0,
    "columns": [
      {
        "uid": "66900b52-235a-4e62-8761-e279ac50c189",
        "kind": 0,
        "standardColumnUid": "3cceebad-7d5a-4943-a102-6267e22227a8",
        "title": "Name",
        "name": "name",
        "formula": "",
        "itemsSource": "",
        "autoClearMethod": 0,
        "isStandard": true,
        "dataSettings": {
          "dataTypeUid": "0234c067-7868-46b2-ba8e-e22fae5255cb",
          "stringLength": 20,
          "numberDigits": 2,
          "primaryKey": true,
          "required": false,
          "unique": false,
          "defaultValue": null
        },
        "renderSettings": {
          "controlKindUid": "",
          "showInItem": true,
          "showInList": true,
          "listColumnWidth": ""
        },
        "validationSettings": {
          "notEmpty": false
        },
        "dependencies": []
      },
      {
        "uid": "07fc5add-bd30-41db-a23c-4f719740fb3c",
        "kind": 0,
        "standardColumnUid": "1e0063d0-288d-494a-8761-1185300d571d",
        "title": "Is deleted",
        "name": "is_deleted",
        "formula": "",
        "itemsSource": "",
        "autoClearMethod": 0,
        "isStandard": true,
        "dataSettings": {
          "dataTypeUid": "4bff64cf-eb01-4933-9f3d-b902336751f4",
          "stringLength": 0,
          "numberDigits": 2,
          "primaryKey": false,
          "required": false,
          "unique": false,
          "defaultValue": null
        },
        "renderSettings": {
          "controlKindUid": "",
          "showInItem": false,
          "showInList": false,
          "listColumnWidth": ""
        },
        "validationSettings": {
          "notEmpty": false
        },
        "dependencies": []
      },
      {
        "uid": "54c17a43-a8e8-4beb-aea8-edc612229282",
        "kind": 0,
        "standardColumnUid": "e647fb57-470e-4547-9a94-2be0f3d0985e",
        "title": "Code",
        "name": "code",
        "formula": "",
        "itemsSource": "",
        "autoClearMethod": 0,
        "isStandard": true,
        "dataSettings": {
          "dataTypeUid": "0234c067-7868-46b2-ba8e-e22fae5255cb",
          "stringLength": 3,
          "numberDigits": 2,
          "primaryKey": false,
          "required": true,
          "unique": true,
          "defaultValue": null
        },
        "renderSettings": {
          "controlKindUid": "",
          "showInItem": true,
          "showInList": true,
          "listColumnWidth": ""
        },
        "validationSettings": {
          "notEmpty": true
        },
        "dependencies": []
      },
      {
        "uid": "2a1aaea8-11cb-44e7-bb0e-73b6c24c9ed3",
        "kind": 0,
        "standardColumnUid": "91a26ae4-5723-4109-8322-7e4e59129239",
        "title": "Title",
        "name": "title",
        "formula": "",
        "itemsSource": "",
        "autoClearMethod": 0,
        "isStandard": true,
        "dataSettings": {
          "dataTypeUid": "0234c067-7868-46b2-ba8e-e22fae5255cb",
          "stringLength": 100,
          "numberDigits": 2,
          "primaryKey": false,
          "required": true,
          "unique": false,
          "defaultValue": null
        },
        "renderSettings": {
          "controlKindUid": "",
          "showInItem": true,
          "showInList": true,
          "listColumnWidth": ""
        },
        "validationSettings": {
          "notEmpty": true
        },
        "dependencies": []
      }
    ],
    "indexes": [
      {
        "uid": "37979c21-835b-4a24-8939-df31083da24d",
        "columns": [
          {
            "columnUid": "07fc5add-bd30-41db-a23c-4f719740fb3c",
            "direction": 0
          }
        ]
      },
      {
        "uid": "2065e56a-e027-4bb2-ba3d-bdb410624a5f",
        "columns": [
          {
            "columnUid": "54c17a43-a8e8-4beb-aea8-edc612229282",
            "direction": 0
          }
        ]
      }
    ]
  },
  "detailTables": [],
  "commands": [],
  "recordsSources": [],
  "recordsSettings": []
}