{
  "$schema": "../../system/schemas/metaObjectStorableSettings.schema.json",
  "uid": "77e25caf-5f94-49ba-b13c-801bc8584aff",
  "metaObjectKindUid": "5449a8ad-9359-41b2-8ff2-3f415eb4da76",
  "title": "Цвет PrimeVue",
  "name": "primevue_color",
  "memo": "Задает общий набор семантических цветов PrimeVue для оформления.",
  "editMethod": 0,
  "orderByExpression": "",
  "displayExpression": "",
  "listFormUid": null,
  "itemFormUid": null,
  "showMainImage": false,
  "saveHistory": 0,
  "version": 0,
  "isActive": true,
  "header": {
    "uid": "71da46c1-4e98-4aad-aad2-5965729ac5d3",
    "title": "header",
    "name": "header",
    "memo": "",
    "autoClearMethod": 0,
    "columns": [
      {
        "uid": "9b9d72a9-9ebe-48e7-8083-a6705c6211cb",
        "kind": 0,
        "standardColumnUid": "3cceebad-7d5a-4943-a102-6267e22227a8",
        "title": "Name",
        "name": "name",
        "formula": "",
        "itemsSource": "",
        "autoClearMethod": 0,
        "isStandard": true,
        "dataSettings": {
          "dataTypeUid": "0234c067-7868-46b2-ba8e-e22fae5255cb",
          "stringLength": 20,
          "numberDigits": 2,
          "primaryKey": true,
          "required": false,
          "unique": false,
          "defaultValue": null
        },
        "renderSettings": {
          "controlKindUid": "",
          "showInItem": true,
          "showInList": true,
          "listColumnWidth": ""
        },
        "validationSettings": {
          "notEmpty": false
        },
        "dependencies": []
      },
      {
        "uid": "22d5659b-09a1-4294-a676-5411d890da44",
        "kind": 0,
        "standardColumnUid": "1e0063d0-288d-494a-8761-1185300d571d",
        "title": "Is deleted",
        "name": "is_deleted",
        "formula": "",
        "itemsSource": "",
        "autoClearMethod": 0,
        "isStandard": true,
        "dataSettings": {
          "dataTypeUid": "4bff64cf-eb01-4933-9f3d-b902336751f4",
          "stringLength": 0,
          "numberDigits": 2,
          "primaryKey": false,
          "required": false,
          "unique": false,
          "defaultValue": null
        },
        "renderSettings": {
          "controlKindUid": "",
          "showInItem": false,
          "showInList": false,
          "listColumnWidth": ""
        },
        "validationSettings": {
          "notEmpty": false
        },
        "dependencies": []
      },
      {
        "uid": "9bb1e5bd-7e59-46e3-9748-2e00ea66d80a",
        "kind": 0,
        "standardColumnUid": "e647fb57-470e-4547-9a94-2be0f3d0985e",
        "title": "Code",
        "name": "code",
        "formula": "",
        "itemsSource": "",
        "autoClearMethod": 0,
        "isStandard": true,
        "dataSettings": {
          "dataTypeUid": "0234c067-7868-46b2-ba8e-e22fae5255cb",
          "stringLength": 3,
          "numberDigits": 2,
          "primaryKey": false,
          "required": true,
          "unique": true,
          "defaultValue": null
        },
        "renderSettings": {
          "controlKindUid": "",
          "showInItem": true,
          "showInList": true,
          "listColumnWidth": ""
        },
        "validationSettings": {
          "notEmpty": true
        },
        "dependencies": []
      },
      {
        "uid": "7919ba9b-0256-4624-ae04-c3e2542e7ff9",
        "kind": 0,
        "standardColumnUid": "91a26ae4-5723-4109-8322-7e4e59129239",
        "title": "Title",
        "name": "title",
        "formula": "",
        "itemsSource": "",
        "autoClearMethod": 0,
        "isStandard": true,
        "dataSettings": {
          "dataTypeUid": "0234c067-7868-46b2-ba8e-e22fae5255cb",
          "stringLength": 100,
          "numberDigits": 2,
          "primaryKey": false,
          "required": true,
          "unique": false,
          "defaultValue": null
        },
        "renderSettings": {
          "controlKindUid": "",
          "showInItem": true,
          "showInList": true,
          "listColumnWidth": ""
        },
        "validationSettings": {
          "notEmpty": true
        },
        "dependencies": []
      }
    ],
    "indexes": [
      {
        "uid": "52d25ff9-dc35-4b9f-aacb-943d8c5896d0",
        "columns": [
          {
            "columnUid": "22d5659b-09a1-4294-a676-5411d890da44",
            "direction": 0
          }
        ]
      },
      {
        "uid": "3d5b878e-49e2-47dd-b390-53277f4b21f6",
        "columns": [
          {
            "columnUid": "9bb1e5bd-7e59-46e3-9748-2e00ea66d80a",
            "direction": 0
          }
        ]
      }
    ]
  },
  "detailTables": [],
  "commands": [],
  "recordsSources": [],
  "recordsSettings": []
}