{
  "$schema": "../../system/schemas/metaObjectStorableSettings.schema.json",
  "uid": "00e33d83-9317-4c20-b710-444eaf83902a",
  "metaObjectKindUid": "032d8377-500f-4631-b435-1f7f69046674",
  "title": "Тег",
  "name": "tag",
  "memo": "Хранит теги для классификации прикладных объектов.",
  "editMethod": 0,
  "orderByExpression": "",
  "displayExpression": "",
  "listFormUid": null,
  "itemFormUid": null,
  "showMainImage": false,
  "saveHistory": 0,
  "version": 0,
  "isActive": true,
  "header": {
    "uid": "1766aa9b-e9ed-49af-ae7b-3d2c5a74b478",
    "title": "header",
    "name": "header",
    "memo": "",
    "autoClearMethod": 0,
    "columns": [
      {
        "uid": "643fb0e7-898d-4ba7-b1c6-12450f84ad3a",
        "kind": 0,
        "standardColumnUid": "4a7c739c-6012-4e45-bfc0-b78a06db8aec",
        "title": "Id",
        "name": "id",
        "formula": "",
        "itemsSource": "",
        "autoClearMethod": 0,
        "isStandard": true,
        "dataSettings": {
          "dataTypeUid": "b327f82a-ea96-416f-9836-785db28eccac",
          "stringLength": 100,
          "numberDigits": 2,
          "primaryKey": true,
          "required": false,
          "unique": false,
          "defaultValue": null
        },
        "renderSettings": {
          "controlKindUid": "",
          "showInItem": true,
          "showInList": true,
          "listColumnWidth": ""
        },
        "validationSettings": {
          "notEmpty": false
        },
        "dependencies": []
      },
      {
        "uid": "df3acc09-c668-42a2-8a22-8426c70d0c74",
        "kind": 0,
        "standardColumnUid": "b20fcd24-ba0f-b5b8-7e4d-39628145533e",
        "title": "Uid",
        "name": "uid",
        "formula": "",
        "itemsSource": "",
        "autoClearMethod": 0,
        "isStandard": true,
        "dataSettings": {
          "dataTypeUid": "6fa9c45b-f514-4fea-a480-8e940636a1df",
          "stringLength": 100,
          "numberDigits": 2,
          "primaryKey": false,
          "required": true,
          "unique": true,
          "defaultValue": "new"
        },
        "renderSettings": {
          "controlKindUid": "",
          "showInItem": false,
          "showInList": true,
          "listColumnWidth": ""
        },
        "validationSettings": {
          "notEmpty": false
        },
        "dependencies": []
      },
      {
        "uid": "42b127c7-abea-43e1-a446-e1f52f66e120",
        "kind": 0,
        "standardColumnUid": "dc3def1b-bffd-4dc8-b0d5-5d34a57fdcb2",
        "title": "Удалено",
        "name": "is_deleted",
        "formula": "",
        "itemsSource": "",
        "autoClearMethod": 0,
        "isStandard": true,
        "dataSettings": {
          "dataTypeUid": "4bff64cf-eb01-4933-9f3d-b902336751f4",
          "stringLength": 100,
          "numberDigits": 2,
          "primaryKey": false,
          "required": false,
          "unique": false,
          "defaultValue": null
        },
        "renderSettings": {
          "controlKindUid": "",
          "showInItem": false,
          "showInList": false,
          "listColumnWidth": ""
        },
        "validationSettings": {
          "notEmpty": false
        },
        "dependencies": []
      },
      {
        "uid": "573e3a7c-c080-4751-b825-d99c7b177847",
        "kind": 0,
        "standardColumnUid": "e163c0c4-de77-4e58-a468-f3527b573e4a",
        "title": "Тег",
        "name": "title",
        "formula": "",
        "itemsSource": "",
        "autoClearMethod": 0,
        "isStandard": true,
        "dataSettings": {
          "dataTypeUid": "0234c067-7868-46b2-ba8e-e22fae5255cb",
          "stringLength": 100,
          "numberDigits": 2,
          "primaryKey": false,
          "required": true,
          "unique": true,
          "defaultValue": null
        },
        "renderSettings": {
          "controlKindUid": "",
          "showInItem": true,
          "showInList": true,
          "listColumnWidth": ""
        },
        "validationSettings": {
          "notEmpty": false
        },
        "dependencies": []
      },
      {
        "uid": "beb97e2c-16f2-4f77-9490-cff22bf0402f",
        "kind": 0,
        "standardColumnUid": "349f72d7-ac0f-40cd-b02d-a5b5f7dcd467",
        "title": "Файлы",
        "name": "is_files",
        "formula": "",
        "itemsSource": "",
        "autoClearMethod": 0,
        "isStandard": true,
        "dataSettings": {
          "dataTypeUid": "4bff64cf-eb01-4933-9f3d-b902336751f4",
          "stringLength": 100,
          "numberDigits": 2,
          "primaryKey": false,
          "required": false,
          "unique": false,
          "defaultValue": null
        },
        "renderSettings": {
          "controlKindUid": "",
          "showInItem": false,
          "showInList": true,
          "listColumnWidth": ""
        },
        "validationSettings": {
          "notEmpty": false
        },
        "dependencies": []
      },
      {
        "uid": "b8c2d6dc-21b3-452c-9608-0c9830e8b8dc",
        "kind": 0,
        "standardColumnUid": null,
        "title": "Цвет",
        "name": "color",
        "formula": "",
        "itemsSource": "",
        "autoClearMethod": 0,
        "isStandard": false,
        "dataSettings": {
          "dataTypeUid": "77e25caf-5f94-49ba-b13c-801bc8584aff",
          "stringLength": 100,
          "numberDigits": 2,
          "primaryKey": false,
          "required": false,
          "unique": false,
          "defaultValue": null
        },
        "renderSettings": {
          "controlKindUid": "",
          "showInItem": true,
          "showInList": true,
          "listColumnWidth": ""
        },
        "validationSettings": {
          "notEmpty": false
        },
        "dependencies": []
      }
    ],
    "indexes": [
      {
        "uid": "0ee4183f-40ba-432c-ae35-4b167e1a5dcc",
        "columns": [
          {
            "columnUid": "42b127c7-abea-43e1-a446-e1f52f66e120",
            "direction": 0
          }
        ]
      },
      {
        "uid": "d8b9149b-7a37-435f-b44d-78f52b1e84d5",
        "columns": [
          {
            "columnUid": "beb97e2c-16f2-4f77-9490-cff22bf0402f",
            "direction": 0
          }
        ]
      },
      {
        "uid": "89ca314c-ef89-46ab-8535-2f5a9bc54456",
        "columns": [
          {
            "columnUid": "573e3a7c-c080-4751-b825-d99c7b177847",
            "direction": 0
          }
        ]
      }
    ]
  },
  "detailTables": [],
  "commands": [],
  "recordsSources": [],
  "recordsSettings": []
}